No,Headline,Body,link19,"Exams sa mga paaralan, pinaplano na ng DepEd  ","ni Lolet Abania  |  March 7, 2022


Pinag-iisipan na ng Department of Education (DepEd) na payagang magsagawa ng mga examinations sa mga paaralan sa gitna ng COVID-19 pandemic.

“Sa ngayon, inaayos pa natin ‘yung ating guidelines para po diyan. Pero bukod po sa mga klase, isa po sa tinitingnan natin na puwede ring gawin ngayon ay ‘yung pagsasagawa ng mga examination,” pahayag ni DepEd Assistant Secretary Malcolm Garma nang tanungin kung kinokonsidera ng DepEd na magsagawa ng graduation ceremonies sa mga campuses.

Binanggit din ni Garma bilang halimbawa ang pagkakaroon ng tinatawag na “large-scale assessments” gaya ng Programme for International Student Assessment (PISA).

“For example, ‘yung ating mga large-scale assessment katulad ng PISA o paglahok natin sa PISA. So ‘yan po ‘yung isa sa mga kinokonsidera na puwede na po nating gawin sa loob ng eskwelahan,” paliwanag ni Garma.

Nang tanungin naman hinggil sa timeline para rito ng DepEd, sinabi ni Garma na pinag-aaralan na nila ang mga iskedyul dahil by batch ginagawa ang naturang aktibidad, habang aniya, posibleng magsimula ito ng Marso.

Matatandaang noong 2020, ipinatupad ng DepEd ang distance learning dahil sa panganib ng COVID-19, kung saan hindi na kailangang magpunta ng mga estudyante sa mga campuses para ipagpatuloy ang kanilang pag-aaral. Sa nasabing setup, kailangan lamang ng mga estudyante na ma-accomplish at mag-submit ng learning modules o pumasok sa mga online classes.

Noong Nobyembre 2021, sinimulan ang pilot testing ng face-to-face classes sa mga piling paaralan sa maraming lugar sa bansa.

Nitong Linggo, inihayag ng DepEd na may 6,925 paaralan sa buong bansa ang handa nang mag-participate sa kanilang “progressive expansion” phase ng F2F classes. Sa nasabing bilang, 6,122 eskuwelahan ang nagpatuloy na sa limited in-person classes.",https://www.bulgaronline.com/post/exams-sa-mga-paaralan-pinaplano-na-ng-deped
20,"Aprub ni P-Du30... Edad ng sexual consent, itinaas sa 16   ","ni Lolet Abania  |  March 7, 2022


Nilagdaan na ni Pangulong Rodrigo Duterte bilang batas ang isang panukala hinggil sa krimen ng statutory rape at itinaas ang edad ng tinatawag na sexual consent mula sa 12-taong-gulang ay naging 16-anyos. 

Matatandaang pinagtibay ng Senado at ng House of Representatives noong Disyembre, ang bicameral conference committee report tungkol sa panukalang, “Act Increasing the Age for Determining Statutory Rape and other Acts of Sexual Abuse and Exploitation to Protect Children.” 

Ang bagong nilagdaang Republic Act 11648 ay naglalayong amyendahan ang RA 3815 o ang Revised Penal Code, RA 8353 o ang Anti-Rape Law of 1997, at RA 7610 o ang Special Protection of Children Against Abuse, Exploitation, and Discrimination Act. 

Sa nakasaad sa ilalim ng RA 11648, “there will be no criminal liability on the part of a person having carnal knowledge of another person under 16 when the age difference between the parties is not more than three years and the sexual act in question is proven to be ‘consensual, non-abusive, and non-exploitative’.” 

Nakapaloob din na ang mga bata, maging lalaki o babae ay itinuturing na ini-exploit sa prostitusyon at iba pang sexual abuse kung patuloy ang isinasagawang sexual intercourse o lascivious na may kaakibat na pera, profit, o anumang pagsasaalang-alang o dahil sa coercion o impluwensiya ng sinumang adult o matanda, sindikato, o grupo. 

Naipasok din dito ng Congress ang isang paragraph o talata, kung saan magmamandato sa Department of Education (DepEd) para isama sa basic education curriculum appropriate subjects, ang tungkol sa mga karapatan at proteksyon ng mga bata na may kaugnayan sa naturang Act. 

Una nang sinabi ni Senate blue ribbon committee chairman Senator Richard Gordon, na siyang nag-sponsored ng Senate Bill 2332, na ang Kngreso sa pamamagitan ng nasabing measure, ay may tungkulin na dapat gawin para sa mapigilan at matugunan ang nangyayaring child sexual abuse sa bansa. 

Ayon pa kay Gordon, “the right of the child to freedom from sexual abuse must be upheld.”",https://www.bulgaronline.com/post/aprub-ni-p-du30-edad-ng-sexual-consent-itinaas-sa-16
21,"Kandidatong hindi dadalo sa debate ng Comelec, hindi makakagamit ng e-rally platform","ni Jasmin Joy Evangelista  |  March 7, 2022


Pirmado na ng Comelec at Vote Pilipinas/Impact Hub Manila ng memorandum of agreement para sa gaganapin na Pilipinas Debates 2022. 

Gaganapin ang unang presidential debate na pangungunahan ng Comelec sa Marso 19, habang susundan naman ito ng vice presidential debate kinabukasan (Marso 20).

""Inaanyayahan namin ang presidential at vice presidential candidates na lumahok sa aming inoorganisang debate. Wala pong ibang layunin ang debateng ito kundi matulungan ang ating mga botanteng malaman kung saan kayo tumatayo sa iba't ibang isyung kinakaharap ng ating lipunan at kung ano ang inyong plano,"" pahayag ni Comelec Acting Chair Socorro Inting.

Ayon kay COMELEC Spokesperson James Jimenez, ang mga kandidatong hindi sasali sa debate ay hindi papahintulutan umere sa E-Rally ng Comelec.

Ang unang presidential debates na itinakda ngayong buwan ay three-hour event at susundin ang single moderator format at walang live audience.

Bubunot ang mga kandidato kung kanino mapupunta ang unang tanong pero sa mga susunod na tanong ay sasagutin sa pamamagitan ng alphabetical order, ayon pa sa Comelec.",https://www.bulgaronline.com/post/kandidatong-hindi-dadalo-sa-debate-ng-comelec-hindi-makakagamit-ng-e-rally-platform
22,Mahigit P12.5 M lotto jackpot sapul ng nag-iisang mananaya,"ni Jasmin Joy Evangelista  |  March 7, 2022


Masuwerteng nasungkit ng isang mananaya mula sa Rizal ang P12.5-million jackpot ng Lotto 6/42 noong Sabado ng gabi. 

Sa advisory na inilabas ng Philippine Charity Sweepstakes Office (PCSO) nasapul ng jackpot winner ang kombinasyon ng mga numerong 18-34-33-39-11-36 at may premyong P12,537,017.20.

Nabili umano ang ticket sa Taytay.

Maaaring i-claim ng naturang bettor ang tseke ng kanyang napanalunan sa PCSO main office sa Mandaluyong City dala ang winning ticket at dalawang ID.",https://www.bulgaronline.com/post/mahigit-p12-5-m-lotto-jackpot-sapul-ng-nag-iisang-mananaya
23,Ka Leody inanunsiyo ang kumpletong Senate slate ng Partido Lakas ng Masa,"ni Jasmin Joy Evangelista  |  March 7, 2022


Inanunsiyo na ni presidential candidate Leody de Guzman ang kanyang complete Senate slate ng Partido Lakas ng Masa (PLM) para sa May 9 elections.

Bukod kina labor leader Luke Espiritu at environmentalists Roy Cabonegro, at David D’Angelo, inendorso rin ng PLM ang 9 pang guest candidates.

Kabilang dito sina Teddy Baguilat, Leila De Lima, Chel Diokno, Risa Hontiveros, at Sonny Matula, Neri Colmenares, Bong Labog, Samira Gutoc, at Agnes Bailen.

Ayon kay De Guzman, ang mga naturang kandidato ang kumumpleto sa kanyang Labor and Ecology Advocates for Democracy slate ng PLM.

Noong Oktubre, ipinakilala ni De Guzman ang kanyang senatorial lineup pero hindi kabilang dito sina Baguilat, Gutoc, at Bailen.",https://www.bulgaronline.com/post/ka-leody-inanunsiyo-ang-kumpletong-senate-slate-ng-partido-lakas-ng-masa
24,Red Cross magsasagawa ng mobile vaccination sa mga bedridden sa Navotas,"ni Jasmin Joy Evangelista  |  March 7, 2022


Nakatakdang magsagawa ng limang araw na mobile vaccination ang Red Cross para sa mga bedridden sa Navotas  simula ngayong araw, March 7. 

Layon ng programang ito na makapagbigay ng bakuna kontra- COVID-19 sa mga residente lalo na sa mga bedridden at sa mga nahihirapang umalis ng bahay. 

Ito ay bukas sa lahat ng residente o empleyado ng Navotas. 

Unang pupuntahan ng PRC vaccination bus ang Bagumbayan North, ang North Bay Blvd., North, at Bangkulasi Nuestro  Senior sa Marso 8, NBBS Proper sa Marso 9, NBBS Dagat-Dagatan  sa Marso 10, at NBBS Kaunlaran at San Rafael Village sa Marso  11.

Puwede ang walk in pero pinapayuhan na magpalista sa kanilang barangay o health center ang mga nais magpabakuna.",https://www.bulgaronline.com/post/red-cross-magsasagawa-ng-mobile-vaccination-sa-mga-bedridden-sa-navotas
25,"2 mangingisda, palutang-lutang, nasagip sa Ilocos Sur","ni Lolet Abania  |  March 6, 2022


Dalawang mangingisda ang nasagip ng mga kapwa nila mangingisda, matapos na makitang palutang-lutang sa karagatan sa bahagi ng Barangay Nalvo sa bayan ng Sta. Maria, Ilocos Sur, ngayong Linggo ng umaga. 

Namataan ang mga ito ng mga mangingisda rin mula sa nasabing barangay at sila ay tinulungan.

Ayon kay Mariano Servanio Jr., isa sa anim na mangingisda na sumagip sa dalawa, habang sila ay nasa laot natanawan nila na mayroong nagwawagayway ng tila damit sa kanila at humihingi ng tulong. 

Agad naman nila itong nilapitan at tumambad sa kanila, ang dalawa na palutang-lutang habang nakagabay sa sirang bangka.

Sa salaysay ng dalawang mangingisda, nanggaling sila sa Bolinao, Pangasinan habang nabangga umano ang kanilang bangka ng isang barko nitong Biyernes.

“Ang kuwento nila, ala-una y media ng madaling-araw, dahil sa pagod sila sa pangingisda, nakatulog sila sa kanilang bangka at nang magising sila ay barko na ang nasa kanilang harapan,” sabi ni Servanio.

Sinabi pa ng mga nailigtas na mangingisda, dalawang gabi silang nagpalutang-lutang habang nakagabay-gabay sa sira nilang bangka.

Agad na dinala sa ospital ang dalawang mangingisda para itsek ang kanilang kondisyon at suriin.

Ipinaalam na rin sa kanilang pamilya ang naganap sa dalawa at sinabing ligtas na ang mga ito.",https://www.bulgaronline.com/post/2-mangingisda-palutang-lutang-nasagip-sa-ilocos-sur
26,"‘Lola Basyang’ Luz Fernandez, pumanaw na  ","ni Lolet Abania  |  March 6, 2022


Pumanaw na ang beteranang aktres na si Luz Fernandez sa edad na 86. 

Nai-share sa Twitter ng kanyang apong si Celestine Trinidad nitong Sabado ang pagpanaw ng aktres, habang naibigay din nito ang mga detalye ng burol ni Luz na nasa Loyola Memorial Chapels sa Marikina. 

“My grandmother passed away today. It’s been a long day and we’ve been busy with arrangements that I didn’t have time to say anything about it here until now,” sabi ni Celestine. 

Sinabi rin ni Celestine na sa Marso 9, Miyerkules, gaganapin ang interment ni Luz, at isusunod na lamang nila ang oras ng libing.  

Nakilala nang husto si Luz sa kanyang role bilang Luka sa “Okay Ka, Fairy Ko.”  

Lumabas din siya sa mga GMA-7 shows gaya ng “Pepito Manaloto,” “Kambal Karibal,” at “Amaya.” 

Noong 2015, binigyang-buhay niya ang role na Lola Basyang sa “Tatlong Kuwento ni Lola Basyang” na obra ni Severino Reyes.",https://www.bulgaronline.com/post/lola-basyang-luz-fernandez-pumanaw-na
27,"Pagbubukas ng klase sa AY2022-2023, posibleng mapaaga – DepEd","ni Lolet Abania  |  March 6, 2022


May posibilidad na magiging maaga ang pagbubukas ng klase para sa Academic Year (AY) 2022-2023, kung magpapatuloy na bumuti ang sitwasyon ng COVID-19 pandemic sa bansa, ayon sa Department of Education (DepEd) ngayong Linggo.

Sa isang interview kay DepEd Undersecretary Nepomuceno Malaluan, sinabi nitong ang susunod na administrasyon ang magsasagawa ng kinakailangang adjustments kung kailan dapat simulan ang susunod na school year. 

“As you know, there will also be an impending transition already of leadership of the DepEd. We will be making our recommendations and the plans based on our decisions. But I suppose that the next administration might still make adjustments to that,” paliwanag ni Malaluan. 

“But, posibleng mas mapaaga lalo na kung tuluy-tuloy itong positive development natin sa COVID outlook,” dagdag niya. 

Ayon kay Malaluan, ang nakatakdang calendar para sa AY 2022-2023 ay maaaring ilabas sa Mayo o Hunyo, na subject aniya para sa posibleng adjustments o pagsasaayos ng papasok na administrasyon.

Matatandaang sinimulan ang Academic Year 2021-2022 noong Setyembre 13, 2021 na halos huling quarter na ng taon dahil pa rin sa COVID-19 pandemic. 

Nasa tinatayang 25 milyong estudyante ang nag-enrolled para sa naturang school year, ayon sa DepEd. 

Iginiit naman ni Malaluan na ang in-person graduation ceremonies para sa AY 2021-2022 ay maaaring payagan kung magpapatuloy din ang pagluluwag ng COVID-19 restrictions.  

“That’s a possibility. Medyo hindi pa naman ngayon ‘yan, sa Hunyo pa ‘yan,” sabi pa ni Malaluan.",https://www.bulgaronline.com/post/pagbubukas-ng-klase-sa-ay2022-2023-posibleng-mapaaga-deped
28,"Sa Marso 10-12... 1.8 M seniors, target na bakunahan sa 4th nat’l vax drive  – DOH","ni Lolet Abania  |  March 6, 2022


Target ng gobyerno na mabakunahan ang tinatayang 1.8 milyon senior citizens sa buong bansa sa ikaapat na bugso ng “Bayanihan, Bakunahan” national vaccination drive ngayong buwan, ayon sa Department of Health (DOH).

Sa isang interview ngayong Linggo, sinabi ni DOH Undersecretary at National Vaccination Operations Center (NVOC) Chairperson Dr. Myrna Cabotaje na ang Bayanihan, Bakunahan 4 ay isasagawa sa Marso 10, 11 at 12, at isasama na ang mga bahay-bahay at pinagtatrabahuhan sa ngayon.

Magiging prayoridad sa ika-4 na bugso ng nationwide vaccination drive ang mga senior citizens na hindi pa nakakumpleto ng kanilang primary dose series at iyong mga nakatakda para sa booster shots.

“Ang total na second dose, ‘yung makamit na second dose ng ating A2 o senior citizens, tsaka mga booster, naglalaro sa 1.8 million ang tinitingnan nating kayang-kayang gawin dapat ng ating mga local government units (LGUs) katuwang ng lahat ng ahensya at private sector,” sabi ni Cabotaje. 

Aminado naman si Cabotaje na bumagal ang pagbabakuna ng mga LGUs nitong nakalipas na linggo, kung saan nasa 300,000 indibidwal lamang ang nabakunahan kumpara sa mga nauna na 1 milyon hanggang 1.5 milyong Pinoy ang naturukan ng COVID-19 vaccine. 

Aniya, ilan din sa mga indibidwal ay nawalan ng tinatawag na sense of urgency pagdating sa pagtanggap ng booster shots.

Gayunman, ayon kay Cabotaje, pabibilisin nila ang pagbabakuna para sa mga primary series at booster shots bago magsimula ang campaign period para sa mga kandidatong tatakbo sa pagka-congressman at mga local elective posts sa Marso 25.

“From now up to that time, bilis-bilisan natin. Ang gagawin nating estratehiya starting with our NVD part 4 ay mas contextualized at granular ika nga. Ngayon, aaralin natin ano ba ang sitwasyon ng mga barangay, ng ating munisipyo, ng ating probinsya. Saan ba siya nagkukulang?” ani Cabotaje. 

Binanggit naman ng opisyal na magpo-focus ang pamahalaan sa pagbabakuna ng booster shots sa mga lugar na naabot na ang 70% target population, habang mga primary series sa mga lugar na mababa ang vaccine rates.

Tiniyak din ni Cabotaje na sapat ang mga suplay ng mga bakuna sa bansa, kung saan aniya, nalampasan pa ang mga vaccine donations ng ibang mga bansa.

“We have enough stocked vaccines. Ang kulang po tayo ay ‘yung [pang] five to 11 [years old]. Halos five million [doses] pa lang ang dumadating. Fifteen million [doses] po ang inorder natin and we are adding additional vaccines later. In tranches, hindi naman sabay-sabay ang dala niya. We will also need Pfizer and Moderna vaccines for our 12 to 17 [years old], kasi ayon lang naman ‘yung may EUA (emergency use authority),” sabi pa ni Cabotaje.",https://www.bulgaronline.com/post/sa-marso-10-12-1-8-m-seniors-target-na-bakunahan-sa-4th-nat-l-vax-drive-doh
29,P1M halaga ng ilegal na kahoy nasabat sa Butuan City,"ni Jasmin Joy Evangelista  |  March 6, 2022


Naaresto ang isang lalaki matapos mahulihan ng umano’y P1 milyon halaga ng ilegal na kahoy sa Butuan City nitong Sabado.

Ayon kay Caraga police director Brig. Gen. Romeo Caramat Jr, nahuli ang 53-anyos na suspek sa Purok 1, Barangay Bading.

Batay sa imbestigasyon ng pulisya, nagsasagawa ng roving ang mga miyembro ng pulis nang mapansin ang lalaki na nagkakarga ng mga kahoy sa isang truck.

Nang lapitan umano ito ng mga pulis at hingan ng dokumento ay wala itong naipakita kaya’t agad itong itinawag sa Department of Environment and Natural Resources at noon din ay inaresto ang suspek. 

Ayon sa DENR, aabot sa 20,000 board feet ang mga nakumpiskang mixed dipterocarp flitches na nagkakahalaga ng P1 milyon.

Sa ngayon, nasa kustodiya ng Butuan City Police Station 2 ang suspek habang hinahanap pa ang isa niyang kasamahan na nakatakas sa operasyon. 

Nakatakdang sampahan ang dalawang suspek ng kaukulang kaso.",https://www.bulgaronline.com/post/p1m-halaga-ng-ilegal-na-kahoy-nasabat-sa-butuan-city
30,Regular employees sa Negros Occidental balik na sa regular work schedule — Mayor Yulo,"ni Jasmin Joy Evangelista  |  March 6, 2022


Ipinag-utos ni Bago City, Negros Occidental Mayor Nicholas Yulo na magbalik na sa regular work schedule ang mga regular na empleyado simula sa Lunes, March 7.

Gayunman, pinaalalahanan ni Yulo ang mga empleyado na patuloy na sundin ang health protocols upang maiwasan ang pagkakahawahan ng COVID-19.

Mahigpit niyang tagubilin ang pagpapatupad ng precautionary measures sa pagbabalik ng normal na operasyon, tulad ng disinfection at decontamination activities, pagsasagawa ng health status check at pagsunod sa physical distancing requirements.

“All agencies are mandated to enforce health standard protocols at all times such as wearing of face masks, taking of body temperature, and setting up of sanitation stations,” ani Yulo.",https://www.bulgaronline.com/post/regular-employees-sa-negros-occidental-balik-na-sa-regular-work-schedule-mayor-yulo
31,Isko sa mga kandidato: ‘Wag gamitin ang mga simbahan sa campaign rallies,"ni Jasmin Joy Evangelista  |  March 6, 2022


Hindi umano dapat gamitin ng mga political candidates ang mga simbahan sa pagsasagawa ng campaign rallies, ayon kay presidential aspirant at Manila Mayor Isko Moreno.

Sa interview ng mga reporter, sinabi ni Moreno na “abnormal” ang pagdadaos ng campaign rally sa church buildings at pagpapaskil ng mga campaign poster dito.

“Sana huwag natin gamitin na rally area ‘yung loob ng simbahan. Katoliko rin po kami, hindi lang po kayo ang may-ari nyan, ‘yan po ay pag-aari ng lahat na kasapi ng simbahang Katoliko,” ani Moreno.

“Ewan ko ang opinyon ng taongbayan na Katoliko na ginagamit ‘yung simbahan as rally area. Hindi ko alam sa kanila but ako sa akin, I am offended as a Catholic. Hindi ko alam kung na-o-offend din ang ibang Katoliko,” dagdag niya. 

Hindi binanggit ni Moreno kung sinong kandidato ang kanyang tinutukoy.

Sa panayam noong Biyernes, pinabulaanan ni Vice President Leni Robredo na ginagamit niya ang simbahang Katoliko para sa kanyang presidential campaign. Ito ay sinabi niya nang tanungin ng media hinggil sa mga kritisismo sa kanyang desisyong pagdaan sa mga simbahan kung saan siya may campaign sorties. 

Ayon pa sa bise presidente, ito ay insulto sa Simbahan at hindi umano papayagan ng institusyong ito na magamit para sa mga partisan activities.",https://www.bulgaronline.com/post/isko-sa-mga-kandidato-wag-gamitin-ang-mga-simbahan-sa-campaign-rallies
32,BBM nangako ng taas-suweldo kapag nakarekober na ang ekonomiya ng bansa,"ni Jasmin Joy Evangelista  |  March 6, 2022


Nangako si presidential aspirant Ferdinand “Bongbong” Marcos na sa sandaling makabangon ang ekonomiya ng bansa ay magpapatupad ito ng pagtaas ng sahod ng mga manggagawang Pinoy, kung maluluklok na pangulo.

Ayon kay Marcos nitong Sabado, posibleng tutulan ng mga negosyante ang pagbibigay ng mas mataas na suweldo ngayong panahon ng pandemya.

“Alam natin ang pangangailangan ng sektor ng paggawa na kailangan ding taasan ang sahod, pero dahil nga hindi pa tayo nakakabangon mula sa pandemya ay siguraduhin muna nating pasiglahin ang kalakalan,” ani Marcos.

“Tiyakin muna natin ang pagbubukas ng mga kumpanya at ang pagbabalik sa trabaho ng ating mga kababayan. Mula sa ganoong konsepto ay titiyakin natin ang kaluwagan at pagbibigay ng maaaring mga benepisyo sa ating mga manggagawa,” dagdag niya.

Parte umano ng pagbangon ng ekonomiya ang mga mamimili at business investment. Aniya, “it is, therefore, necessary for people to have jobs to be able to spend and pump up the economy.”

“Alam ng management (ng mga kumpanya), ng pamahalaan, at mga manggagawa ang kalagayan ng ekonomiya kaya lahat ay nagtitiis. Kahit nakikita na natin ang unti-unting pagbangon ay kailangan pa ding patatagin muna ang kalakalan at iyan ang ating pagsisikapang gawin,” pahayag pa ng dating senador.

Iginiit din ni Marcos na ang mga micro, small at medium enterprises ang siyang magiging backbone ng kanyang economic program, dahil karamihan umano sa mga manggagawa ay galing sa sektor na ito. Sinabi rin niya na malaki ang ambag ng trade and commerce sa bansa upang makamit ang economic viability.",https://www.bulgaronline.com/post/bbm-nangako-ng-taas-suweldo-kapag-nakarekober-na-ang-ekonomiya-ng-bansa
33,"LPA, magdudulot ng pag-ulan sa Visayas, Caraga at Davao Region — PAGASA","ni Lolet Abania  |  March 5, 2022


Huling namataan ang isang low pressure area (LPA) na nasa layong 540 kilometro silangan ng Surigao City bandang alas-3:00 ng hapon ngayong Sabado, ayon sa PAGASA.

Batay sa 24-hour weather forecast ng PAGASA, inaasahang magdudulot ang LPA ng maulap na papawirin na may kalat-kalat na pag-ulan sa bahagi ng Visayas, Caraga, at Davao Region. 

Ayon sa PAGASA, makararanas din ang Central Visayas at Eastern Visayas, maging ang Caraga at Davao regions ng maulap na papawirin na may kalat-kalat na pagbuhos ng ulan at thunderstorms na posibleng may kasamang  flash floods o landslides dahil sa katamtaman hanggang sa malakas na mga pag-ulan dulot ng LPA.

Makararanas naman ang Metro Manila at ang natitirang bahagi ng bansa ng bahagyang maulap hanggang sa maulap na papawirin na may pabugsu-bugsong pag-ulan o thunderstorms dahil sa easterlies o localized thunderstorms na posibleng may kasamang flash floods o landslides sa severe thunderstorms.

Sa wind speed forecast naman ng PAGASA para sa Northern Luzon ay mahina hanggang sa katamtaman habang ang coastal water conditions ay bahagya hanggang sa katamtaman.

Ang natitirang bahagi ng bansa ay makararanas ng mahina hanggang sa katamtamang wind speed at bahagya hanggang sa katamtamang coastal water conditions.",https://www.bulgaronline.com/post/lpa-magdudulot-ng-pag-ulan-sa-visayas-caraga-at-davao-region-pagasa
34,"Algae sa Boracay beach, ‘di toxic — BIARMG","ni Lolet Abania  |  March 5, 2022


Hindi senyales na may mababang antas ng kalidad ng tubig ang pagkakaroon ng green algae sa baybaying isla ng Boracay dahil ito ay tinatawag lamang na natural phenomenon, ayon sa Boracay Interagency Rehabilitation Management Group (BIARMG) ngayong Sabado. 

Sa isang statement, sinabi ng BIARMG na ang algae ay normal na dumarami sa tuwing dry season o tag-init. “This is non-toxic and should not be a cause for concern. In fact, the volume of algae has naturally subsided significantly in the past 2 weeks,” pahayag ng BIARMG. 

Paliwanag pa ng BIARMG, ang fecal coliform levels sa front beach ng isla ay nasa pagitan ng 8 hanggang 11 mpn (most probable number) kada 100 milliliters mula Enero hanggang Pebrero 2022. Anila, nakamit naman nito ang water quality standards para makapag-swimming na nasa 100 mpn kada 100 ml.  

“The tourists are assured that Boracay’s waters are clean and safe for swimming and BIARMG is steadfast in its mandate to provide accurate information to the public,” sabi ni BIARMG general manager Martin Jose V. Despi.  

Ayon sa Boracay city environment and natural resources office, inaasahan na magtatagal ang mga algae doon hanggang Abril o Mayo.",https://www.bulgaronline.com/post/algae-sa-boracay-beach-di-toxic-biarmg
