No,Headline,Body,link69,Libreng 1-araw na unli ride sa nagpabakuna sa LRT2 — LRTA,"ni Lolet Abania  |  March 1, 2022


Inanunsiyo ng Light Rail Transit Authority (LRTA) ngayong Martes na magbibigay sila ng free one-day unlimited pass sa mga commuters na nagpabakuna kontra-COVID-19 sa iba’t ibang Light Rail Transit Line 2 (LRT2) vaccination sites.

Sa isang statement, ayon sa LRTA ang inisyatibong ito ay may kaugnayan sa ginagawang pagsisikap ng Department of Transportation (DOTr) para isulong ang ligtas na public transport system at makatulong sa COVID-19 vaccination drive ng gobyerno.

“This free ride program aims to encourage more commuters to get vaccinated and boosted. We need to step up our vaccination efforts in order to ensure the safety and protection of our commuting public,” pahayag ng LRTA Management. 

Ang pass, kung saan valid para sa isang araw na unlimited use, ay agad na iiisyu matapos na mabakunahan ang pasahero sa LRT2 vax sites.

Ang pasahero na nais i-avail ang pagsakay sa LRT2 ay kailangang magprisinta ng kanyang pass at isang valid ID sa security o station personnel sa pagpasok ng mga gates para magamit ang nasabing free rides.

Noong nakaraang buwan, ang LRTA Recto at Antipolo Stations ay nagkaroon ng COVID-19 vaccination sites.

Sa Marso 7 naman, ayon sa pamunuan ng LRTA, magdadagdag sila ng vaccination site na gagawin sa LRT2 Araneta Center-Cubao station katuwang ang lokal na pamahalaan ng Quezon City.

Ang vaccination site sa Cubao ay bukas tuwing Lunes mula alas-8:00 ng umaga hanggang alas-4:00 ng hapon kung saan magbibigay ng unang dose at booster shots.

Ang Recto Station vax site naman ay bukas tuwing Martes at Huwebes mula alas-8:00 ng umaga hanggang alas-5:00 ng hapon habang ang Antipolo Station vax site ay bukas tuwing Miyerkules at Biyernes mula alas-8:30 ng umaga hanggang alas-4:00 ng hapon.

Ayon pa sa pamunuan ng LRTA, dahil sa nararanasang pagdami ng bilang ng mga nagnanais na magpabakuna kontra-COVID-19 o tinatawag nang vaccinees sa mga LRT2 sites, ang lokal na gobyerno ng Manila, Antipolo at Quezon City ay handang magdagdag ng initial target ng 200 vaccinees sa isang araw kada vaccination site hangga’t ito ay kinakailangan.",https://www.bulgaronline.com/post/libreng-1-araw-na-unli-ride-sa-nagpabakuna-sa-lrt2-lrta
70,Maraming Pinoy sa Ukraine ayaw pang umuwi sa Pilipinas ,"ni Jasmin Joy Evangelista  |  March 1, 2022


Maraming Pinoy sa Ukraine ang ayaw pa ring umuwi ng Pilipinas sa kabila ng ginagawang pag-atake ng Russia.

Ayon sa Department of Foreign Affairs (DFA), umaasa ang mga Pilipino rito na matatapos din agad ang kaguluhan at nagpupunta na lamang sa ligtas na lugar.

""There were 13 Filipinos who were able to cross the border. Twelve adults, one baby. They are now in Warsaw, Poland, in a hotel, being assisted by our embassy. They already took the RT-PCR test and once they test negative, they will be able to go home [to the Philippines] tonight or tomorrow. They were also given $200 assistance,"" pahayag ni DFA Undersecretary Sarah Arriola sa Laging Handa briefing nitong Lunes.

""But we learned there are 33 people who left Kyiv and are in Lyiv, and there are those still leaving Kyiv to go to Lyiv, and they don't want to be repatriated. They want to wait it out [in Lyiv], so we are just in touch with them and stand ready to give assistance as needed. They think this [armed attack] will be over in two to three months,"" dagdag pa ni Arriola.

Kabilang umano sa mga Pinoy na nasa Ukraine ay nagtatrabaho bilang household service workers, mga guro, mga kawani sa international organizations, at mayroon ding nakapag-asawa na ng Ukraine citizens.

""Many of them don't want to be separated with their family members too, and they like the quality of life in Ukraine,"" anang opisyal.

""So rest assured we stand ready to be of assistance and give care packages to them,"" dagdag ni Arriola.

Samantala, pinayuhan ng DFA ang mga Pinoy na malapit sa border ng Moldova at Romania na kailangan ng tulong para makauwi ng Pilipinas, na makipag-ugnayan sa Philippine Embassy sa Budapest.",https://www.bulgaronline.com/post/maraming-pinoy-sa-ukraine-ayaw-pang-umuwi-sa-pinas-dfa
71,Matapos tawaging duwag… Mayor Sara hindi dadalo ng mga debate; mangangampanya na lamang — spox,"ni Jasmin Joy Evangelista  |  March 1, 2022


Magpo-focus na lang umano sa pangangampanya si vice presidential bet Mayor Sara Duterte-Carpio kaysa dumalo sa mga debate, ayon sa kanyang spokesperson nitong Lunes.

""Mayor Sara has already decided to do a campaign without attending debates and instead work her hardest on the ground to continue to earn the trust and win the vote of the people as the next Vice President of the Philippines,"" ano Liloan, Cebu Mayor Christina Frasco. 

Ito ay ipinahayag ni Frasco isang araw matapos tawaging duwag ni vice presidential candidate former Akbayan Representative Walden Bello si Duterte-Carpio dahil sa hindi pagdalo sa vice presidential debate noong Linggo. 

Tinawag din ni Bello na duwag si presidential candidate Ferdinand “Bongbong” Marcos.

""Candidates are at liberty to decide whether or not to accept invitations to debates,"" ani Frasco.

""It is also within a candidate s discretion to limit his exposure to tweets and soundbytes only, as Walden Bello has done, or to have direct and personal engagement with the people, as Mayor Sara has shown this entire campaign season,"" dagdag niya. 

Ayon pa kay Frasco, nabisita na ni Mayor Sara ang 70 siyudad, bayan, isla, at mga probinsiya, sa loob lamang ng halos 2 buwan.

Iiwan din umano ni Mayor Sara ang Davao City na walang pagkakautang, 4th Most Competitive City in the Philippines, at 7th richest City in the country. Sa loob lamang ng halos 5 taon sa panunungkulan bilang alkalde, nakatanggap na ng 118 awards, citations, at recognitions si Mayor Sara.",https://www.bulgaronline.com/post/spox-mayor-sara-magpo-focus-sa-kampanya-kaysa-dumalo-sa-mga-debate
72,Mga asong na-rescue sa QC ite-train bilang community service dogs,"ni Jasmin Joy Evangelista  |  March 1, 2022


Nakatakdang i-train ng Quezon City Veterinary Department (QCVD) ang mga asong gala sa Quezon City upang maging mga service dogs.

Base sa report ng QCVD, nakaka-rescue sila ng 57 na aso kada araw, kabilang ang mga isinu-surrender ng mga may-ari nito. Lahat ng ito ay binibigyan ng matitirahan at kabilang sa candidates for rehabilitation at adoption upang maging pet ng QCitizen families, emotional support dogs, o maging explosive detection dogs.

“Before training them, our veterinarians make sure that the rescued animals undergo comprehensive assessment, health check, and even temperament test. This is for us to determine if a dog is suitable as a pet or a community service canine,” ani Mayor Joy Belmonte.

Bawat aso ay sasailalim sa three-day observation at Safety Assessment for Evaluating Rehoming (SAFER) test na tutukoy sa comfort level with restraint and touch ng aso, reaksiyon sa mga bagong karanasan, katulad ng movement and sound stimuli, bite inhibition, behaviour sa paligid ng mga pagkain at laruan, at pakikitungo sa ibang aso.
 Sasailalim din sila sa screening ng mga karaniwang sakit tulad ng Parvovirus, Distemper, Transmissible Venereal Tumor at Mange and parasitism. Tanging mga malulusog na aso lamang ang qualified sa Rehabilitation and Adoption Program.

“Since the establishment of the QC Animal Care and Adoption Center in November, the city has already partnered with the Quezon City Police District and Bureau of Fire Protection. These agencies will be the first recipients of selected sheltered dogs that they will further train as drug, bomb-sniffing, and rescue dogs,” pahayag pa ni Belmonte.",https://www.bulgaronline.com/post/mga-asong-na-rescue-sa-qc-ite-train-bilang-community-service-dogs
73,DOJ official Aglipay-Villar nagbitiw sa puwesto,"ni Jasmin Joy Evangelista  |  March 1, 2022


Nagbitiw sa puwesto si Justice Undersecretary Emmeline Aglipay-Villar matapos ang halos apat na taong serbisyo sa DOJ.

Sa mensahe sa mga reporters, sinabi ni Justice chief Menardo Guevarra na epektibo ang resignation ni Aglipay-Villar sa March 21.

""It is with deep sadness that I announce the resignation of Atty. Emmeline Aglipay-Villar as undersecretary of the Department of Justice,"" ani Guevarra.

""She will campaign for her husband, former DPWH secretary Mark Villar, who is running for senator in the upcoming elections in May,"" dagdag niya.

Sinabi rin ni Guevarra na patuloy na magtatrabaho si Aglipay-Villar hanggang sa huling araw nito sa departamento.

“Usec. Em will continue to work until her last day in office. As of today, no other Usec. or Asec. is leaving the DOJ,” aniya.

Si Chief State Counsel George Ortha II ang magiging OIC undersecretary sa pag-alis ni  Aglipay-Villar.

Si Aglipay-Villar ay naitalaga sa DOJ noong 2008.",https://www.bulgaronline.com/post/asawang-ex-dpwh-chief-ikakampanya-doj-official-aglipay-villar-nag-resign
74,"Work from home, optional na sa Alert Level 1 – DTI","ni Lolet Abania  |  February 28, 2022


Magiging optional na ang work-from-home arrangement sa mga lugar na isasailalim sa Alert Level 1 sa susunod na buwan dahil na rin sa bumubuting sitwasyon ng COVID-19 sa bansa, ayon sa Department of Trade and Industry (DTI).

Sa isang interview ngayong Lunes kay DTI Secretary Ramon Lopez, sinabi nitong hinihikayat na ang pagkakaroon ng mga onsite work sa ilalim ng Alert Level 1.

“Ie-encourage ‘yung onsite work [under Alert Level 1], ibig sabihin less na ‘yung work from home, magiging optional na ‘yung work from home,” sabi ni Lopez.

Asahan na mangyari ito para aniya, lumakas ang mga negosyo, gaya ng mga stores at restaurants dahil sa marami na ring tao ang lalabas ng kanilang mga bahay.

“Ang maganda dito kapag pumapasok na uli ‘yung mga tao physically, nabubuhay ‘yung mga restaurants at ‘yung mga tindahan, ‘yung mga stores, kasi nasa labas ‘yung mga tao at wala na sa bahay,” paliwanag ni Lopez.

Una nang inanunsiyo ng gobyerno nitong weekend na isasailalim ang National Capital Region (NCR) at marami pang lugar sa bansa sa Alert Level 1 mula Marso 1 hanggang 15, 2022.

Ayon kay Lopez, sa ilalim ng Alert Level 1, lahat ng establisimyento, mga tao, o aktibidad ay pinapayagan nang mag-operate ng 100% capacity. Gayunman, ang vaccination requirement ay mananatili para sa indoor activities. 

“Magbubukas ang ekonomiya but less ang restrictions,” ani opisyal.

Sinabi pa ni Lopez na ang requirements para sa intrazonal at interzonal travels ay mababawasan na rin.

“Wala na ‘yung requirement na RT-PCR [test], ‘yung mga PNP clearance. Pero malaking bagay pa rin ‘yung vaccination card,” saad pa ni Lopez.",https://www.bulgaronline.com/post/work-from-home-optional-na-sa-alert-level-1-dti
75,"Vice Admiral Abu, itinalagang PCG commandant","ni Lolet Abania  |  February 28, 2022


Itinalaga ni Pangulong Rodrigo Duterte si Vice Admiral Artemio Abu bilang chief ng Philippine Coast Guard (PCG) epektibo Pebrero 28, 2022, ayon sa naturang ahensiya.

Sa isang pahayag ng PCG ngayong Lunes na nai-post sa kanilang Facebook page, nagsilbi si Abu bilang Commander ng Maritime Safety Services Command (MSSC) at Task Force Commander ng PCG Task Force Kaligtasan sa Karagatan, bago pa siya na-appointment bilang PCG Commandant.

Naglabas naman ng kopya ang PCG ng appointment papers ni Abu bilang bagong hepe ng PCG.

Si Abu ay miyembro ng Philippine Military Academy (PMA) Class of 1992 at mayroong Master’s Degree in Marine Management sa Dalhousie University sa Halifax, Nova Scotia, Canada.

Bilang isang Coast Guard officer, ayon sa PCG si Abu ay na-assigned na commander ng PCG District Southern Visayas, PCG District Southern Tagalog, at Coast Guard Education, Training, at ng Doctrine Command.

Nagsilbi rin si Abu bilang Commanding Officer sa iba’t ibang PCG ships, kung saan nabigyan siya ng pinakaminimithi ng marami na “Command at Sea” badge.

“All units that CG Vice Admiral Abu commanded, both ashore and afloat, received the distinction as ‘Best Unit of the Year’ at the national level. CG Vice Admiral Abu was recognized as a Distinguished Cavalier Awardee for 2021 in the field of Coast Guard operation. The said award is the highest recognition given to PMA alumni for their outstanding achievements in the field of government service,” pahayag pa ng PCG. 

Sa ngayon, wala pang kumpirmasyon ang Malacañang hinggil sa appointment ni Abu bilang ika-29 chief ng PCG.",https://www.bulgaronline.com/post/vice-admiral-abu-itinalagang-pcg-commandant
76,"Suspensyon ng e-sabong license, aprub kay P-Du30 – Sotto  ","ni Lolet Abania  |  February 28, 2022


Inaprubahan na ni Pangulong Rodrigo Duterte na isuspinde muna ang mga lisensiya ng online cockfighting o “e-sabong”, habang nakabinbin ang resolusyon ng mga kaso ng 31 missing cockfighting enthusiasts o “sabungeros,” ayon kay Senate President Vicente Sotto III ngayong Lunes na mula aniya, sa ibinigay na impormasyon ni Senador Ronald dela Rosa. 

“Sen. Dela Rosa informed me that PRRD told him yesterday that he agrees!” ani Sotto sa isang tweet. Subalit, wala pang kumpirmasyon sa ngayon si Dela Rosa hinggil sa naging pahayag ni Sotto. Samantala, sinabi ng Malacañang na maghintay na lamang muna ang publiko ng anunsiyo na manggagaling kay Pangulong Duterte.  

“Abangan na lang natin mamaya sa Talk to the People, or even before that kung meron kaming ilalabas na announcement,” sabi ni acting Presidential Spokesperson Karlo Nograles sa isang press briefing. 

Si Dela Rosa ay siyang chairman ng Senate Committee on Public Order and Dangerous Drugs, kung saan iniimbestigahan ang pagkawala ng 31 sabungero. 

Sa isang Senate hearing noong nakaraang linggo, nag-propose ng isang resolution sina Sotto at Senador Panfilo Lacson na humihiling kay Pangulong Duterte para atasan nito ang Philippine Amusement and Gaming Corporation (PAGCOR) na pansamantalang itigil ang mga e-sabong operations. 

Kabilang sa mga existing e-sabong licenses ay sa Belvedere Vista Corp., Lucky 8 Star Quest Inc., Visayas Cockers Club Inc., Jade Entertainment And Gaming Technologies, Inc., Newin Cockers Alliance Gaming Corp., Philippine Cockfighting International Inc. at Golden Buzzer, Inc. 

Ayon kay PAGCOR Acting Assistant Vice President for E-Sabong Department na si Diane Erica Jogno, agad namang susunod ang ahensiya sa pagpapasuspinde sa mga lisensiya ng mga e-sabong. 

“We are okay with suspending e-sabong and we will secure approval from the Office of the President,” sabi ni Jogno. 

Nakatakda naman ang susunod na Senate hearing hinggil sa nawawalang sabungero sa Biyernes, Marso 4.",https://www.bulgaronline.com/post/suspensyon-ng-e-sabong-license-aprub-kay-p-du30-sotto
77,"MRT3, 100% passenger capacity na bukas — DOTr  ","ni Lolet Abania  |  February 28, 2022


Itataas na ang passenger capacity sa MRT3 sa 100% mula sa dating 70% simula bukas, Marso 1, kasabay ng pagsasailalim sa National Capital Region (NCR) sa Alert Level 1 mula naman sa dating Alert Level 2, ayon sa Department of Transportation (DOTr) ngayong Lunes. 

Sinabi ng DOTr na ang MRT3 ay may kapasidad na maglulan ng 1,182 pasahero bawat train set o 394 kada wagon. Binubuo ang bawat train set ng tatlong wagon.

“Ang pagtataas ng kapasidad ng mga tren ay bilang tugon ng pamunuan ng MRT-3 at Kagawaran ng Transportasyon sa pagtaas ng demand sa pampublikong transportasyon sa pagbubukas ng mas maraming establisimyento sa Metro Manila,” pahayag ng DOTr sa Facebook.

Gayunman, paalala ng ahensiya sa mga pasahero na mahigpit pa ring ipatutupad ang minimum public health standards, kung saan ang magsalita o makipag-usap, kumain, uminom at sumagot sa mga tawag sa cell phones ay mananatiling ipinagbabawal sa loob ng mga tren.

Ayon pa sa DOTr, ang mga pasahero ay required pa rin na magsuot ng face mask subalit ang pagsusuot ng face shields ay mananatiling boluntaryo. 

“Upang matiyak ang kaayusan at implementasyon ng minimum public health standards sa buong linya, patuloy na magtatalaga ng mga train at platform marshals ang pamunuan ng MRT-3 sa mga tren at istasyon nito,” dagdag ng ahensiya.",https://www.bulgaronline.com/post/mrt3-100-passenger-capacity-na-bukas-dotr
78,POLO: 35K OFWs sa Taiwan puwedeng mag-apply ng permanent residency,"ni Jasmin Joy Evangelista  |  February 28, 2022


Nasa 35,000 overseas Filipino workers (OFWs) sa Taiwan ang qualified sa bagong permanent residency program sa naturang bansa na nakatakdang magsimula sa Abril, ayon kay POLO Taipei Labor Attaché Cesar Chavez Jr.

Ayon kay Chavez, eligible ang mga naturang OFW sa mga kondisyon na itinakda sa ilalim ng bagong Ministry of Labor measure.

Sa ilalim ng initial guidelines, maaring makakuha ng Alien Permanent Resident Certificate (APRC) ang mga foreign workers kung pasok ang mga ito sa required tenure na anim na taong pagtatrabaho sa Taiwan, bukod pa sa hiwalay na limang taon na employment.

Bago pa man ilabas ang bagong sistema na ito, pinapayagan lamang ang mga manggagawa sa manufacturing industry sa maximum na 12 taon, at ang mga empleyado naman bilang caretakers at domestic workers ay hanggang 14 na taon.

“Ito ‘yung nakikitang solusyon ng Taiwanese government, kasi may mga shortage din sila sa workers kaya pinapayagan na nilang maaaring mag-qualify ‘yung mga matatagal na dito sa Taiwan,” ani Chavez sa isang panayam.

“Ayaw na nilang bitawan ito, kaya binigyan nila ng option na pwedeng magkaroon ng permanent residency based on the length of service and upgraded skill,” patuloy niya.

Ayon pa kay Chavez, kailangang ma-reclassify o ma-upgrade ang skills ng mga manggagawa pagkatapos ng anim na taon na pagiging empleyado at kailangan ding manatili muna sila sa bansa ng karagdagang limang taon pa, o kabuuang 11 taon, bago sila maging qualified sa naturang programa.

 Ngayon ay mayroong mahigit 140,000 Filipino workers sa Taiwan, 85% sa mga ito ay nasa manufacturing habang ang 15% ay mga caregivers o domestic workers.

“Gustong gusto ng mga employer dahil magagaling ang mga Pinoy diyan, kahit minimum supervision lang or kahit iwanan mo ‘yan ay naa-accomplish ‘yung trabaho, so gustong gusto tayo diyan,” ani Chavez.",https://www.bulgaronline.com/post/polo-35k-ofws-sa-taiwan-puwedeng-mag-apply-ng-permanent-residency
79,Nigerian patay matapos umanong manlaban sa ikinasang buy-bust operation ng pulisya,"ni Jasmin Joy Evangelista  |  February 28, 2022


Patay ang isang Nigerian national habang nakatakas naman ang kasama nito sa isinagawang buy-bust operation ng Quezon City Police District (QCPD) at PNP Drug Enforcement Group sa kahabaan ng Batasan-San Mateo Road sa Quezon City, kagabi. 

Ayon sa mga operatiba, isang kilo ng umano'y shabu ang nabili sa kaniya.

""Itong namatay nakipag-engage sa mga pulis natin,"" ani Police Lieutenant Colonel Alex Sonido, hepe ng Batasan Police Station.

Nakuha mula sa napatay na suspek ang nasa dalawang kilo ng umano'y shabu na tinatayang nagkakahalaga ng P13.6 milyon.",https://www.bulgaronline.com/post/nigerian-patay-matapos-umanong-manlaban-sa-ikinasang-buy-bust-operation-ng-pulisya
80,Presidential bets: Customs una sa listahan ng lalabanan ang korapsiyon,"ni Jasmin Joy Evangelista  |  February 28, 2022


Halos lahat ng presidential bets ay sinabing kung sila ang mananalong pangulo ay uunahin nilang labanan ang korapsiyon sa Bureau of Customs (BOC).

Nang tanungin kung anong ahensiya ang unang iimbestigahan hinggil sa mga alegasyon ng korapsiyon sa ginanap na CNN Philippines presidential debate, sinabi nina Ernesto Abella, Norberto Gonzales, Leody de Guzman, Panfilo Lacson, Faisal Mangondato, Jose Montemayor Jr., Isko Moreno, at Leni Robredo na mag-uumpisa sila sa BOC.

Si Manny Pacquiao ang nag-iisang nagsabi na magsisimula siyang mag-imbestiga sa Department of Health.

Si Ferdinand “Bongbong” Marcos ay hindi dumalo sa naturang debate.",https://www.bulgaronline.com/post/presidential-bets-customs-una-sa-listahan-ng-lalabanan-ang-korapsiyon
81,House-to-house Covid vaccination sinimulan na sa QC,"ni Jasmin Joy Evangelista  |  February 28, 2022


Sinimulan na ng Barangay workers sa Quezon City ang house-to-house COVID-19 vaccination sa mga residente nito. 

Dinadala nila ang mga hindi bakunado sa barangay hall.

Ito ang bagong estratehiya ng Department of Health (DOH) upang ma-boost ang vaccination rate sa bansa.

Nitong Sabado, pansamantalang isinara ng Quezon City ang mga regular na vaccination sites upang magsagawa ng area-based inoculation kung saan nasa 100 pop-up vaccination sites ang itinayo sa iba’t ibang lugar sa mga barangay. 

Nasa kabuuang 130 teams na binubuo ng mga doktor, nurse, allied healthcare workers, at barangay workers at volunteers ang bumaba sa mga purok upang magbakuna sa mga hindi pa nakatatanggap ng kanilang first dose, second dose, o booster. 

Ayon sa Quezon City government ang vaccination rate sa adult population ay halos nasa 100 percent na pero mababa pa rin ang bilang ng mga nagpapa-booster.

“Nahihirapan tayong mag-encourage sa ating mga adults na magpa-booster. Siguro a third of eligible adults na puwedeng magpabakuna pa lang ang nagpapabakuan. So, that’s only 30 percent siguro,"" ani Mayor Joy Belmonte.",https://www.bulgaronline.com/post/house-to-house-covid-vaccination-sinimulan-na-sa-qc
82,"22 Pinoy na nasa Ukraine, nakatakdang i-repatriate — DFA   ","ni Lolet Abania  |  February 27, 2022


Dalawampu’t dalawang Filipinos na apektado ng invasion ng Russia sa Ukraine ang naghihintay na ng kanilang repatriation sa bansa, ayon sa Department of Foreign Affairs (DFA). 

Sa isang tweet ngayong Linggo ni DFA Undersecretary Sarah Lou Arriola, sinabi nitong sa kabuuang bilang na Pinoy, apat ang nasa western city ng Lviv sa Ukraine, habang 13 ay nasa Warsaw, Poland, at 5 naman sa Moldova. 

Ayon pa kay Arriola, anim na Pinoy na ang nakabalik sa bansa. Kinumpirma naman ni Arriola sa isang interview na ang 13 na nasa Poland ay naghahanda nang umuwi ng Pilipinas. Aniya, ang mga naturang Pinoy ay tumawid sa Polish border mula sa Ukraine at nakasama na ni DFA Secretary Teodoro Locsin, Jr. 


Ipinahayag din ni Arriola na 181 Filipinos ang lumipad patungong Lviv mula sa capital city Kyiv, kung saan maraming nagaganap na sagupaan. 

Ilang Pinoy naman aniya, ang ayaw na iwanan ang nasabing bansa dahil sa mga asawang nilang Ukrainians. Ayon pa kay Arriola, mayroon ding mga Pinoy household service workers sa Kyiv na nagsabing mag-e-evacuate sila kasama ang kanilang mga employers. 

Ngayong Linggo (oras sa Manila), ipinahayag ni Ukranian President Volodymyr Zelenskiy na ang mga tropa ng kanilang bansa ay patuloy na lalaban sa mga Russian forces. 

Una nang sinabi ng DFA na ang mga nangangailangan ng repatriation assistance ay pinapayuhang kontakin o tawagan ang Philippine Embassy sa Poland sa pamamagitan ng mga sumusunod na detalye: 

• Email: (warsaw.pe@dfa.gov.ph) 
• Emergency Mobile Number +48 604 357 396 
• Office Mobile Number +48 694 491 663 
• Philippine Honorary Consulate General in Kyiv, Ukraine -- Mobile Number +380 67 932 2588 

Maaaring makontak ang DFA sa kanilang Facebook page.",https://www.bulgaronline.com/post/22-pinoy-na-nasa-ukraine-nakatakdang-i-repatriate-dfa
83,"150 bahay, nasunog sa Cavite City","ni Lolet Abania  |  February 27, 2022


Umabot sa tinatayang 150 kabahayan ang naabo matapos na muling sumiklab ang sunog sa Cavite City ngayong Linggo.

Halos wala pang isang buwan nang unang maganap ang sunog noong Pebrero 12, sa Barangay 24, 25, 26, at 27 sa Zone 3, Caridad, sa Cavite City din, kung saan 100 kabahayan ang natupok habang 760 pamilya ang labis na naapektuhan. 

Ayon kay Cavite Provincial Fire Director Supt. Rene Bullos, nasa 150 tirahan sa Barangay 10-B, Aplayang Munti ang nasunog bandang alas-4:00 ng madaling-araw ngayong Linggo.

Sa ipinakitang video ni Cavite City Vice Mayor Denver Chua, malalaking apoy ang bumalot sa maraming kabahayan na malapit sa sementeryo.

""Mayroon po tayong isang residente dito na nakausap. Kinukuwento niya na nagsimula ‘yung sunog nang magkaroon po ng brownout. Pagpatay po ng ilaw, doon na po nagsimula,” pahayag sa video ni Chua.

Sa ulat ng Bureau of Fire Protection (BFP), umabot sa ikatlong alarma ang sunog na ideklarang fire out bandang alas-6:00 ng umaga. 

Ani BFP, gawa sa light materials ang mga bahay habang dikit-dikit pa ang mga ito.
 Mabilis ding kumalat ang apoy sa mga kabahayan na sinabay ng malakas na hangin.

Walang naiulat na nasaktan matapos ang sunog, subalit hindi pa mabatid ng mga awtoridad ang bilang ng mga pamilyang naapektuhan.",https://www.bulgaronline.com/post/150-bahay-nasunog-sa-cavite-city
84,"NCR, Alert Level 1 na simula Marso 1-15 – IATF","ni Lolet Abania  |  February 27, 2022


Inaprubahan na ng Inter-Agency Task Force (IATF) ang pagsasailalim sa National Capital Region (NCR) sa COVID-19 Alert Level 1 simula Marso 1 hanggang Marso 15, 2022.

Ito ay matapos na irekomenda kamakailan ng Metro Manila Council (MMC) na binubuo ng 17 mga alkalde ng naturang rehiyon na ilagay na ang NCR sa Alert Level 1.

Naipahayag din ng Department of Health (DOH) na handa na ang Metro Manila na isailalim sa Alert Level 1.",https://www.bulgaronline.com/post/ncr-alert-level-1-na-simula-marso-1-15-iatf
