No,Headline,Body,link35,"Mandatory booster shots, ‘di kailangan — DOH","ni Lolet Abania  |  March 5, 2022


Ipinahayag ng Department of Health (DOH) na hindi pa kailangan na imandato ang COVID-19 booster shots sa publiko sa ngayon, habang anila, marami pang paraan para ikampanya ang isinasagawang vaccination drive sa bansa.   

Ito ang naging tugon ng DOH, matapos ang suhestiyon ni Presidential Adviser for Entrepreneurship Joey Concepcion na ang COVID-19 booster cards ay gawing mandatory sa mga establisimyento sa mga lugar na isinailalim sa Alert Level 1 o sa mga lugar na ang pag-administer ng mga primary series ng pagbabakuna ay natapos na.  

Ngayong linggo, ang Metro Manila at 38 iba pang lugar ay isinailalim sa pinakamababang COVID-19 alert level system na kinokonsidera na ring nasa “new normal”, para makaahon na sa pagkalugmok ng ekonomiya ng bansa dahil sa pandemya. 

“Naiintindihan natin kung saan... Ang perspektibo [ni Concepcion] gusto niya ng full protection pero sa ngayon, ang ating gagawin ay magbibigay tayo ng information at pakikiusapan ang business sector,” sabi ni DOH Undersecretary Myrna Cabotaje sa isang televised briefing ngayong Sabado. 

“Ang gagawin natin ay i-strengthen natin ang advocacy . . . [Ang government agencies] at partners natin sa private sectors ay pag-iibayuhin ’yung communication and advocacy to increase the uptake of booster,” paliwanag ng opisyal. 

Una nang sinabi ni Cabotaje na ang National Vaccination Days na gagawin ngayong buwan ay magpo-focus sa mga residential houses at workplaces o pinagtatrabahuhan, kung saan naging matagumpay ito sa ilang lugar sa bansa. 

Aminado naman ang opisyal na nananatiling mabagal ang pagbabakuna kontra-COVID-19 nitong mga nakaraang linggo. Hanggang ngayong linggo, nasa tinatayang 63 milyong indibidwal ang fully vaccinated na o 70 percent ng target ng gobyerno na 90 milyong Pilipino. Nasa mahigit 10.1 milyong indibidwal naman ang nakatanggap na ng kanilang booster shots.",https://www.bulgaronline.com/post/mandatory-booster-shots-di-kailangan-doh
36,Bata na-chainsaw ng ama,"ni Jasmin Joy Evangelista  |  March 5, 2022


Matindi ang natamong sugat ng isang 13-anyos na batang lalaki matapos na aksidenteng tamaan ng chainsaw ng kanyang ama sa bayan ng Laoang, Northern Samar.

Ayon sa mga awtoridad, nagpuputol ng kahoy ang ama ng biktima nang biglanb mabitawan nito ang chainsaw at tumilapon sa anak na noon ay tumutulong sa kanya. 

Nagtamo ng sugat sa tiyan hanggang dibdib ang bata.

Kaagad na dinala sa ospital ang bata at ngayon ay nangangailangan ng tulong sa pagpapagamot.",https://www.bulgaronline.com/post/bata-na-chainsaw-ng-ama
37,VP Leni kumpiyansang makukuha ang Cavite sa kabila ng pag-endorso ni Gov. Remulla sa Uniteam,"ni Jasmin Joy Evangelista  |  March 5, 2022


Malaki ang kumpiyansa ni vice president at presidential bet Leni Robredo na makukuha niya ang Cavite ngayong May 2022 elections.

Ito ay sa kabila ng pag-endorso ni Cavite Governor Jonvic Remulla sa pambato ng Uniteam na sina former senator Bongbong Marcos at Davao City Mayor Sara Duterte-Carpio. Kasabay nito ay hiniling ni Remulla sa kanyang nasasakupan na ibigay ang 800,000 boto sa Marcos-Duterte tandem.

Sigaw naman ng supporters ni VP Leni, “800K minus one” — bawat isa sa kanila ay babawas sa hangad na boto para sa Uniteam, na siyang ikalawang most-vote rich province sa bansa.

Sa isang panayam, inihayag ni Robredo na siya ay confident na makukuha ang boto ng Cavite sa kabila ng pag-endorso ni Remulla sa Uniteam.

“The numbers are understandable,” ani Robredo. “Our opponent prepared hard for this while I have decided very late.”

“[Back then], I had a lot of things in 2016 that I do not have now, like endorsements of local government officials. But I have much now that I did not have back then, and that is my volunteers,” paliwanag niya sa mga reporters.",https://www.bulgaronline.com/post/vp-leni-kumpiyansang-makukuha-ang-cavite-sa-kabila-ng-pag-endorso-ni-gov-remulla-sa-uniteam
38,Presyo ng petrolyo posibleng tumaas pa ng P4-5 kada litro sa susunod na linggo —  industry source,"ni Jasmin Joy Evangelista  |  March 5, 2022


Posible pa umanong tumaas ang presyo ng petrolyo sa susunod na linggo kung saan ito na ang magiging ika-10 sunod na linggo ng weekly hikes, dahil sa patuloy na pagtaas ng global crude oil sa gitna ng Ukraine-Russia war.

Batay sa oil trading monitoring sa nakalipas na limang araw, base sa Mean of Platts Singapore, sinabi ng oil industry source sa GMA News Online na posibleng tumaas ang presyo kada litro ng diesel ng P5.30 hanggang P5.50.

Ang presyo naman ng gasolina ay posibleng tumaas ng P3.50 hanggang P3.70 kada litro. 

Samantala, batay sa Unioil Petroleum Philippines’ price forecast mula March 8 hanggang 14 trading week, posibleng tumaas ang presyo ng P4 kada litro ang habang P3 kada litro naman ang gasolina.",https://www.bulgaronline.com/post/presyo-ng-petrolyo-posibleng-tumaas-pa-ng-p4-5-kada-litro-sa-susunod-na-linggo-industry-source
39,Wala raw moral ascendancy… BBM hindi kayang pamunuan ang bansa — Pacquiao,"ni Jasmin Joy Evangelista  |  March 5, 2022


Naniniwala umano si Senator Manny Pacquiao na walang moral ascendancy si former senator Ferdinand “Bongbong Marcos” Jr. para pamunuan ang bansa dahil sa tax-related case nito.

Sa panayam ng mga reporters kay Pacquiao sa Nueva Ecija, pinuna ni Pacquiao ang mga botante na sumusuporta umano sa mga politikong may maduming record at kilala bilang corrupt. 

“Basta ako, nagreremind ako sa kanila, ang pinakabobo talaga ’yung mga boboto ng mga nagnanakaw, kasi ninakawan ka na, boboto mo pa,” ani Pacquiao.

Nang tanungin kung naniniwala siyang may right o moral ascendancy si Marcos Jr. na maging pangulo, sagot ni Pacquiao: “Para sa akin, siyempre, kandidato rin ako, siyempre masasabi ko na wala.”

“Bayan, alalahanin natin ha, kasali siya doon sa Napoles case. Baka nakalimutan ng taumbayan ’yung Napoles.”",https://www.bulgaronline.com/post/wala-raw-moral-ascendancy-bbm-hindi-kayang-pamunuan-ang-bansa-pacquiao
40,Dahil sa mahabang pila at maraming transaksiyon… 13 branches ng SSS bukas ngayong araw,"ni Jasmin Joy Evangelista  |  March 5, 2022


Matapos makatanggap ng mga report hinggil sa mahabang pila ng mga members at pensioners sa labas ng Quezon City headquarters, inanunsiyo ng Social Security System (SSS) na magbubukas ang 13 Metro Manila branches nito ngayong araw, Sabado.

Sa inilabas na advisory, sinabi ng SSS na ang mga sumusunod na branches ay nag-extend ng  service hours hanggang 7 p.m. nitong Biyernes: Diliman; Cubao; San Francisco Del Monte; Batasan Hills; J.P. Rizal-Makati; Pasig-Pioneer; New Panaderos; Parañaque; SM Aura-Taguig; Las Piñas; Alabang-Muntinlupa; Binondo; at Manila.

“These branches will also be open from 8 a.m. to 5 p.m. on Saturday, March 5. Please observe standard health protocols (such as social distancing, temperature check, and wearing of face masks),” ayon sa SSS advisory.

Ayon pa sa SSS, ang extension ng service hours at pagbubukas sa araw ng Sabado ay dahil sa mataas na bilang ng mga transaksiyon dala ng bagong alert level na ipinatupad.

“The selected SSS branches will accept all transactions except the automated tellering system (ATS) facility from 8 a.m. until 5 p.m. on Saturday,” paliwanag ng SSS.

“The SSS urges its members and claimants to utilize its online facilities such as the My.SSS portal and the SSS mobile app. Since March 2020, the SSS has shifted majority of its over-the-counter transactions to the My.SSS and SSS mobile app platforms to allow its members to conduct their transactions 24/7 at the comfort of their homes or offices,” dagdag pa nito. 

Pinaalalahanan din ng ahensiya ang mga miyembro at mga pensioners: “the majority of SSS benefit claim and loan applications can be submitted online through members’ My.SSS accounts on the SSS website or via the SSS mobile app.”

“Payments may also be made online or over-the-counter through banks and non-bank collecting agents.”

The SSS’s advisory on its social media pages reminded members and pensioners that “the majority of SSS benefit claim and loan applications can be submitted online through members’ My.SSS accounts on the SSS website or via the SSS mobile app.” It added that “payments may also be made online or over-the-counter through banks and non-bank collecting agents.”",https://www.bulgaronline.com/post/dahil-sa-mahabang-pila-at-maraming-transaksiyon-13-branches-ng-sss-bukas-ngayong-araw
41,"Kakulangan sa tubig, maiwasan.. Cloud seeding, isasagawa na — NWRB","ni Lolet Abania   |  March 4, 2022


Plano ng pamahalaan na magsagawa ng cloud seeding operations upang maiwasan ang posibleng kakulangan sa tubig sa panahon ng tag-init, ayon sa National Water Resources Board (NWRB).  

“Ngayong buwan Marso at Abril ay nag-ready na rin po ang (Metropolitan Waterworks and Sewerage System) at mga konsesyonaryo doon po sa tinatawag nating cloud seeding operations,” pahayag ni NWRB executive director Dr. Sevillo David Jr. sa isang interview. 

“At ‘yan po ay gagawin ngayong Marso’t Abril at nakikipag-ugnayan po ang MWSS sa PAGASA, ‘yun pong sapat na panahon para po makapag-conduct po,” anang opisyal. 

Ayon kay David, ang water level ng Angat Dam, isa sa pinakamalalaking pinagmumulan ng tubig sa Metro Manila ay nasa 195.9m sa ngayon. Bagama’t sapat ang suplay ng tubig, nanawagan naman si David sa publiko na kailangang magtipid ng tubig upang makatulong sa gobyerno na para maiwasan ang posibleng pagkakaroon ng krisis sa tubig sa dry months. 

“Ngayon po ay sa tingin po natin may sapat namang suplay ng tubig na nanggagaling sa Angat Dam, particular po itong mga panahon ng tag-init… Kaya lang po ay nakikiusap din tayo sa mga kababayan natin na magtipid pa rin po kasi hindi ho ganoon kaganda ‘yung lebel ‘no, medyo mababa po ‘yan sa mga inaasahan po natin,” giit ni David. 

“At mas maganda po ay pagtulungan po natin ang tamang paggamit ng tubig para naman po mapanatili natin ‘yung medyo maganda-gandang level po ng Angat Dam,” sabi nito. Aniya, bukod sa cloud seeding ay may iba pang measures na kanilang ginagawa para matiyak na magiging sapat ang suplay ng tubig sa Metro Manila. 

“Kagaya po dito sa Metro Manila, ay nakahanda po ‘yung mga deep wells at mga treatment plants, para po makatulong ‘no sa pagbibigay ng… para may mapagkunan tayo ng karagdagang tubig po kung sakali po, kung patuloy mang bumaba ang Angat Dam at magkaroon ng adjustment sa alokasyon, ay meron pa hong pwedeng mapagkunan para makadagdag doon sa pangangailangan po natin ng tubig bukod po sa Angat Dam,” paliwanag ni David. 

“Sa parte po ng mga irigasyon ay ‘yung mga magsasaka po natin at NIA (National Irrigation Administration) po ay tumutulong din po ‘no dito sa kasalukuyang sitwasyon at mina-manage po nila ‘yung mga nare-release po na tubig na galing sa Angat Dam,” saad ng opisyal. 

“At hindi ho nila sinasayang ‘yan at mga nagkakaroon nga po ng tinatawag na mga shallow tube wells para naman po mas ma-optimize ‘no, ‘yung tubig na nare-release po’t nagagamit na irigasyon at mga kanal po,” banggit pa ni David.",https://www.bulgaronline.com/post/kakulangan-sa-tubig-maiwasan-cloud-seeding-isasagawa-na-nwrb
42,"Missing sabungero, 34 na ","ni Lolet Abania  |  March 4, 2022


Umabot na sa 34 ang nawawalang sabungero matapos na madagdagan ng tatlo pa ang naunang naitalang 31, ayon kay Senador Ronald “Bato” dela Rosa. 

“Thirty-one lang pala ‘yung allegedly missing persons involved in game fixing but meron pa palang three missing persons ang allegedly involved in cloning accounts,” pahayag ni Dela Rosa sa ginanap na hearing ngayong Biyernes ng Senate Committee on Public Order and Dangerous Drugs na siyang chairman.

“This brings to a total of 34. Correction po hindi 31, kundi 34 na ang missing persons na recorded by the PNP (Philippine National Police),” sabi ni Dela Rosa.

Ito ang kinumpirma ni Police Brigadier General Eliseo Cruz, chief ng Criminal Investigation and Detection Group (CIDG) sa naging pahayag ng senador.

Subalit, ayon kay Cruz, anim lamang sa mga ito ang hawak ng kanyang tanggapan.

“Yes, sir. But we are only handling six cases,” ani Cruz.

Hiniling naman ni Dela Rosa kay Cruz na imbestigahan din ang iba pang nawawalang sabungero, habang sinabi ng hepe ng CIDG na nakikipag-ugnayan na sila sa mga Police Regional Offices.

Una nang napabalita na ang pinakamaraming nawawalang sabungero ay matatagpuan sa Laguna na may 19, anim naman sa Maynila, anim sa Batangas, dalawa sa Bulacan habang ang isa ay dinukot sa bahay nito sa San Pablo, Laguna.",https://www.bulgaronline.com/post/missing-sabungero-34-na
43,"4th COVID-19 dose sa senior at immunocompromised, inirekomenda – NTF","ni Lolet Abania  |  March 4, 2022


Nagsumite ng rekomendasyon ang Vaccine Expert Panel (VEP) hinggil sa pagbibigay ng 4th COVID-19 dose o 2nd booster shot para sa mga senior citizens at immunocompromised na mga indibidwal, ayon sa National Task Force (NTF) Against COVID-19.  

Sinabi ni NTF medical adviser Dr. Ted Herbosa, ang rekomendasyon ay isinumite sa mga health experts at technical advisory group, habang naghihintay sila ng approval ng Inter-Agency Task Force (IATF).

 “As of now mayroong recommendation ‘yung ating VEP para sa pagbigay ng 4th dose o 2nd booster dose para sa mga senior at immunocompromised. Ito ngayon ay pinasa na sa ating technical advisory group,” pahayag ni Herbosa sa Laging Handa briefing ngayong Biyernes.

 “Hintayin na lang natin kung maaprubahan ito ng ating IATF para ma-implement na sa susunod na panahon,” saad pa niya.

Una nang sinabi ng VEP na dahil ang mga immunocompromised ay nakatanggap na ng tatlong primary series ng COVID-19 vaccine, ang kanilang fourth dose ay magsisilbi bilang kanilang booster shot.

Ang Department of Health (DOH) ay nag-a-administer na ng third dose sa mga senior citizens at immunocompromised, habang booster shots naman ang ibinibigay sa mga nakakumpleto na ng tatlo hanggang anim na buwang requirement matapos na makatanggap ng kanilang second dose.

Ayon pa kay Herbosa, nasa 10.5 milyon lamang mula sa tinatayang 63.4 milyon na fully vaccinated individuals ang nakatanggap ng kanilang third dose.

Target naman ng DOH na magsagawa ng fourth wave ng “Bayanihan, Bakunahan” national vaccination drive para sa mga senior citizens sa ikalawang linggo ng Marso.",https://www.bulgaronline.com/post/4th-covid-19-dose-sa-senior-at-immunocompromised-inirekomenda-ntf
44,"Artes, bagong MMDA chief – P-Du30","ni Lolet Abania  |  March 4, 2022


Itinalaga ni Pangulong Rodrigo Duterte si Romando Artes bilang chairman ng Metropolitan Manila Development Authority (MMDA).

Batay sa dokumentong inisyu ni Executive Secretary Salvador Medialdea, nilagdaan ng Pangulo ang appointment letter ni Artes nitong Marso 1.

Ayon sa inilabas na statement ng ahensiya, si MMDA Undersecretary Frisco San Juan Jr. ay na-appoint naman bilang general manager kasabay ng pagiging deputy chairman ng agency.

Papalitan ni Artes si Benhur Abalos, na nag-resigned noong nakaraang buwan para suportahan si dating Senador Ferdinand “Bongbong” Marcos Jr. na tatakbo sa pagka-pangulo sa May 9 elections.

Isang abogado at certified public accountant, si Artes ay unang nagsilbi sa MMDA bilang assistant general manager for finance and administration noong Mayo 2017, naging general manager noong Oktubre 2021, at officer-in-charge noong Pebrero 2022. 

“It is an honor to be appointed as the MMDA chairman. The agency has been my home for the past five years -- from the term of the late Chairman Danilo Lim and later under Chairman Abalos,” sabi ni Artes. 

“I will continue to work for the completion of the projects and programs needed and pursuant to our mandates - traffic, solid waste and flood management, urban renewal, public safety among others and the equally important COVID-19 vaccination as we transition to the new normal,” dagdag pa nito.",https://www.bulgaronline.com/post/artes-bagong-mmda-chief-p-du30
45,"Dahil wala nang physical distancing... Protocols sa PUVs, mahigpit na ipatupad – DOH","ni Lolet Abania  |  March 4, 2022


Mariing ipinaalala ni Department of Health (DOH) Undersecretary Maria Rosario Vergeire sa publiko na dapat pa ring sumunod sa mga health protocols kaugnay sa COVID-19 sa kabila na niluwagan na ang alert level restrictions sa maraming lugar sa bansa.

Sa isang interview nitong Huwebes, sinabi ni Vergeire na batid ng Inter-Agency Task Force on Emerging Infectious Diseases (IATF) na wala nang physical distancing sa mga public transportation na pinayagang mag-operate ng 100% capacity.

“Ang isa pang napag-usapan hindi talaga maipapatupad ang physical distancing sa ating mga public transport because kailangan po ng tao eh, para makarating sila sa kanilang mga essential na gagawin,” sabi ni Vergeire.

“Kelangan lang po talaga meron po tayong adequate enforcement. Enforcement to monitor, eto pong mga pagpapatupad ng safety protocols,” dagdag niya.

Iginiit din ni Vergeire na hindi maaaring kumain o uminom at mag-usap-usap sa loob ng public utility vehicles (PUVs) at hindi rin puwedeng tanggalin ang face mask kapag nasa loob ng public transport, kung saan kailangang mahigpit na ipatupad, habang pakiusap niya sa mga operators at drivers ng public transport na hindi dapat lumagpas sa 100% seating capacity lamang ang mga pasaherong kanilang isinasakay.

“Ang naobserbahan po natin for these past days na nag-Alert Level 1 tayo, beyond 100% capacity po ang naipapatupad, wala pong nag-e-enforce, walang nagmo-monitor, katulad sa mga bus, lahat dapat nakaupo, wala na pong nakatayo para hindi masyadong siksikan,” diin ni Vergeire.",https://www.bulgaronline.com/post/dahil-wala-nang-physical-distancing-protocols-sa-puvs-mahigpit-na-ipatupad-doh
46,Olongapo City naabot na ang herd immunity vs. COVID-19,"ni Jasmin Joy Evangelista  |  March 4, 2022


Nakamit na ng Olongapo City ang herd immunity laban sa COVID-19 matapos maabot ang target na mabakunahan, ayon sa datos ng local government unit (LGU) nitong Huwebes.

Ayon sa COVID-19 task force ng siyudad, at least 191, 825 residente rito ang nakumpleto na ang primary series ng kanilang bakuna mula nang simulan ng LGU ang mass inoculation sa kalagitnaan ng 2021.

Kasunod nito ay nag-improve ang COVID-19 situation sa siyudad na ngayon ay mayroon na lamang 14 active cases.

Nasa 29, 312 residente naman ang nakatanggap na ng kanilang booster shots habang patuloy naman ang mass vaccination kabilang ang mga batang edad 5 pataas. 

Mayroong 260,000 populasyon ang Olongapo City base sa 2020 census.",https://www.bulgaronline.com/post/olongapo-city-naabot-na-ang-herd-immunity-vs-covid-19
47,"Karagdagang 804,000 doses ng COVID-19 vaccine para sa mga bata, dumating na","ni Jasmin Joy Evangelista  |  March 4, 2022


Dumating na sa bansa ang karagdagang 804,000 doses ng COVID-19 vaccine ng Pfizer-BioNTech na nakalaan para sa mga batang edad 5-11 nitong Huwebes ng gabi.

Ayon sa National Task Force Against COVID-19, ang bagong shipment na ito ay lumapag sa Ninoy Aquino International Airport pasado alas-9 ng gabi.

Ito ay kasunod ng 804,000 pediatric shots na naihatid sa bansa noong Miyerkules.

Binili ng pamahalaan ang mga naturang bakuna sa pamamagitan ng pautang mula sa World Bank.

Sa pangkalahatan, nakatanggap na ang bansa ng 1.6 milyong bakuna laban sa COVID-19 para sa mga bata.

Umabot na sa 736, 880 mga batang 5-11 years old ang nabakunahan mula nang magsimula ito noong Pebrero 7, ayon sa Department of Health.",https://www.bulgaronline.com/post/karagdagang-804-000-doses-ng-covid-19-vaccine-para-sa-mga-bata-dumating-na
48,Siksikan at mahaba ang pila… Mga magsisimba sa Quiapo dagsa ngayong first Friday ng Marso,"ni Jasmin Joy Evangelista  |  March 4, 2022


Dumagsa ang mga nagsimba sa Quiapo Church ngayong unang Biyernes ng Marso.

Siksikan at mahaba ang pila sa bahagi ng Villalobos Street ng mga nais makadalo ng misa sa loob ng Quiapo Church.

Ayon sa Plaza Miranda Police Community Precint (PCP) ng Manila Police District (MPD), tinatayang nasa dalawang libo ang bilang ng mga tao kaninang 7:00 a.m. sa loob at paligid ng simbahan. 

Matatandaan na una nang ipinatupad ngayong linggo ang Alert Level 1 sa Metro Manila.",https://www.bulgaronline.com/post/siksikan-at-mahaba-ang-pila-mga-magsisimba-sa-quiapo-dagsa-ngayong-first-friday-ng-marso
49,Sara Duterte nais itigil ang mga lockdown; magpo-focus sa pagbibigay ng trabaho 'pag naging VP,"ni Jasmin Joy Evangelista  |  March 4, 2022


Nais ni Uniteam vice presidential candidate at Davao City Mayor Sara Duterte-Carpio na itigil ang mga lockdown at kawalan ng trabaho para sa mga Pilipino sanhi ng COVID-19 pandemic.

Sinabi ni Duterte-Carpio na magpo-focus siya sa pagbibigay ng trabaho sa mga Pinoy sakaling manalong vice president sa Mayo.

“Tigilan ang lockdown o alert level. Bukas, sarado. Bukas, sarado ang mga negosyo. Ibalik natin ang mga negosyo. Ibalik natin ang mga trabaho na nawala dahil sa pandemya,” ani Duterte-Carpio nitong Huwebes sa ginanap na rally sa Calatagan, Batangas.

“Ang dami po sa ating mga kababayan ang nawalan ng trabaho dahil sa pandemya. Doon po muna tayo tututok, ibalik natin ang trabaho na mawala dahil sa pandemya,” dagdag niya.

Ang ipinatupad na lockdowns ng gobyerno ng kanyang ama na si Pangulong Rodrigo Duterte ay isa sa mga pinakamahabang lockdown sa buong mundo, na siyang ipinatupad upang makontrol ang pagdami ng bilang ng tinatamaan ng virus sa bansa.

Ayon pa kay Inday Sara, kung siya ay mananalo sa pagka-bise president, magpo-focus siya sa  entrepreneurship, peace building in communities, at child protection.",https://www.bulgaronline.com/post/sara-duterte-nais-itigil-ang-mga-lockdown-magpo-focus-sa-pagbibigay-ng-trabaho-pag-naging-vp
50,P977.47 milyon para sa expansion ng F2F classes — DepEd,"ni Lolet Abania  |  March 3, 2022


Naglaan ang Department of Education (DepEd) ng P977.47 milyon para makatulong sa pangangailangan ng mga paaralan na nagsasagawa ng limited in-person classes sa ilalim ng expansion phase. 

Ayon kay DepEd Undersecretary Annalyn Sevilla, ang naturang halaga ay gagamitin para pondohan ang Maintenance and Other Operating Expenses (MOOE) ng mga paaralan. 

“Marami po sa mga pondo na atin pong pinaghahandaan ay ‘yun pong physical arrangements ng eskuwelahan, ‘yun pong protection and safety ng mga learners at mga guro, at siyempre po ‘yung mga learning resources na kailangan natin,” ani Sevilla sa Laging Handa public briefing nitong Miyerkules. 

Batay sa report, ang mga elementary schools, na humahawak ng Kindergarten hanggang Grade 6 students ay makakatanggap ng pinakamalaking share na P531.36 milyon. 

Gayundin, ang mga Junior High Schools, na sakop ang Grade 7 hanggang 10 ay makakatanggap ng P303.62 milyon habang ang mga Senior High Schools na mula Grade 11 hanggang 12 ay mabibigyan naman ng P142.49 milyon.  

“These amounts are to be downloaded [or] released to the Regional Offices. The Regional Directors are authorized to allocate the said amounts among schools considering the implementation status of face-to-face classes in their respective regions,” pahayag ng DepEd sa kanilang report. 

Sa mga regional offices, ang Central Luzon ang makakatanggap ng pinakamalaking alokasyon na mahigit sa P80 milyon. Sinabi pa ng DepEd na ire-retain naman ang P41.47 milyon o 4.24 percent ng kabuuang pondo na anang ahensiya, “as a contingency fund.”",https://www.bulgaronline.com/post/p977-47-milyon-para-sa-expansion-ng-f2f-classes-deped
51,"Scholarship, suspendido muna sa papasok sa 1st year college — CHED","ni Lolet Abania  |  March 3, 2022


Inanunsiyo ng Commission on Higher Education (CHED) ngayong Huwebes na ang proseso ng scholarship application para sa mga papasok na first-year college students ay suspendido muna dahil sa kakulangan ng pondo. 

“CHED will temporarily suspend the application to CHED Scholarship Program (CSP) for incoming first-year college students for Academic Year (AY) 2022-2023,” post sa Facebook ng CHED. 


“The suspension is an offshoot of budget inadequacy in the Commission’s FY 2022 budget for StuFAPs (Student Financial Assistance Programs),” dagdag pa ng ahensiya. 

Sa isang memorandum na may petsang Pebrero 21, inatasan ni CHED Chairperson Prospero de Vera III ang mga regional offices ng komisyon para magpakalat ng impormasyon hinggil dito, upang maiwasan ang mga fake news at kalituhan sa mga estudyante na nagnanais na mag-apply ng scholarship. 

Matatandaang nai-report na ng CHED noong Setyembre, na ang commission ay nag-provide ng financial aid sa mahigit 2 milyong estudyante.",https://www.bulgaronline.com/post/scholarship-suspendido-muna-sa-papasok-sa-1st-year-college-ched
